StockCode,Description,Quantity,UnitPrice,Country,Rating
35818P,"ACRYLIC JEWEL ICICLE, PINK",1,3.36,United Kingdom,4
35957,SMALLFOLKART BAUBLE CHRISTMAS DEC,2,1.66,United Kingdom,3
35961,FOLKART ZINC HEART CHRISTMAS DEC,1,1.66,United Kingdom,0
35971,ROSE FOLKART HEART DECORATIONS,1,2.51,United Kingdom,5
37449,CERAMIC CAKE STAND + HANGING CAKES,1,21.23,United Kingdom,4
37476,CONDIMENT TRAY 4 BOWLS AND 4 SPOONS,1,18.68,United Kingdom,1
47559B,TEA TIME OVEN GLOVE,2,2.51,United Kingdom,1
47591B,SCOTTIES CHILDRENS APRON,2,1.66,United Kingdom,2
47591D,PINK FAIRY CAKE CHILDRENS APRON,1,4.21,United Kingdom,2
47593B,SCOTTIE DOGS BABY BIB,2,0.85,United Kingdom,5
48188,DOORMAT WELCOME PUPPIES,1,14.43,United Kingdom,3
71459,HANGING JAM JAR T-LIGHT HOLDER,8,1.69,United Kingdom,0
72586,SET OF 6 HALLOWEEN GHOST T-LIGHTS,1,0.85,United Kingdom,5
72799E,IVORY PILLAR CANDLE SILVER FLOCK,2,3.36,United Kingdom,5
72799F,IVORY PILLAR CANDLE GOLD FLOCK,2,3.36,United Kingdom,1
72807A,SET/3 ROSE CANDLE IN JEWELLED BOX,1,8.47,United Kingdom,4
72807B,SET/3 OCEAN SCENT CANDLE JEWEL BOX,1,8.47,United Kingdom,1
72807C,SET/3 VANILLA SCENTED CANDLE IN BOX,1,8.47,United Kingdom,3
72816,SET/3 CHRISTMAS DECOUPAGE CANDLES,1,2.51,United Kingdom,3
79030D,"TUMBLER, BAROQUE",1,12.72,United Kingdom,4
79030G,"TUMBLER, NEW ENGLAND",1,12.72,United Kingdom,3
82551,LAUNDRY 15C METAL SIGN,1,2.51,United Kingdom,5
82583,HOT BATHS METAL SIGN,1,4.21,United Kingdom,2
82613B,"METAL SIGN,CUPCAKE SINGLE HOOK",1,2.51,United Kingdom,3
82613D,METAL SIGN CUPCAKE SINGLE HOOK,1,2.51,United Kingdom,2
84031A,CHARLIE+LOLA RED HOT WATER BOTTLE ,4,4.21,United Kingdom,0
84031B,CHARLIE LOLA BLUE HOT WATER BOTTLE ,1,4.21,United Kingdom,1
84032A,CHARLIE+LOLA PINK HOT WATER BOTTLE,8,3.36,United Kingdom,0
84086C,PINK/PURPLE RETRO RADIO,1,4.21,United Kingdom,2
84279P,CHERRY BLOSSOM  DECORATIVE FLASK,1,8.47,United Kingdom,4
85015,SET OF 12  VINTAGE POSTCARD SET,1,2.51,United Kingdom,2
85016,SET OF 6 VINTAGE NOTELETS KIT,2,2.51,United Kingdom,0
85017A,ENVELOPE 50 ROMANTIC IMAGES,1,0.85,United Kingdom,4
85017B,ENVELOPE 50 BLOSSOM IMAGES,1,0.85,United Kingdom,4
85032D,YULETIDE IMAGES GIFT WRAP SET,2,1.66,United Kingdom,0
85039A,SET/4 RED MINI ROSE CANDLE IN BOWL,3,1.66,United Kingdom,0
85048,15CM CHRISTMAS GLASS BALL 20 LIGHTS,1,16.98,United Kingdom,2
85064,CREAM SWEETHEART LETTER RACK,1,11.02,United Kingdom,0
85127,SMALL SQUARE CUT GLASS CANDLESTICK,2,10.17,United Kingdom,1
85129D,BEADED CRYSTAL HEART PINK SMALL,1,2.51,United Kingdom,2
85131B,BEADED CRYSTAL HEART GREEN ON STICK,2,0.85,United Kingdom,0
85132A,CHARLIE + LOLA BISCUITS TINS,2,8.47,United Kingdom,1
85135C,RED DRAGONFLY HELICOPTER,1,8.47,United Kingdom,0
85176,SEWING SUSAN 21 NEEDLE SET,5,1.66,United Kingdom,5
85177,BASKET OF FLOWERS SEWING KIT,1,1.66,United Kingdom,5
85178,VICTORIAN SEWING KIT,1,2.51,United Kingdom,3
85186A,EASTER BUNNY GARLAND OF FLOWERS,1,0.85,United Kingdom,1
85232B,SET OF 3 BABUSHKA STACKING TINS,1,4.95,United Kingdom,2
90003C,MIDNIGHT BLUE PAIR HEART HAIR SLIDE,1,3.81,United Kingdom,3
90018A,SILVER M.O.P ORBIT DROP EARRINGS,1,4.24,United Kingdom,0
90022,EDWARDIAN DROP EARRINGS JET BLACK,1,3.81,United Kingdom,0
90071,RUBY GLASS CLUSTER EARRINGS,1,1.26,United Kingdom,5
90099,NECKLACE+BRACELET SET BLUE HIBISCUS,1,5.06,United Kingdom,4
90116,FRUIT SALAD BAG CHARM,1,2.51,United Kingdom,4
90120C,GREEN MURANO TWIST BRACELET,1,4.24,United Kingdom,4
90129A,PINK GLASS TASSLE BAG CHARM ,2,1.66,United Kingdom,4
90129B,TURQUOISE GLASS TASSLE BAG CHARM ,1,1.66,United Kingdom,5
90161A,ANT COPPER RED BOUDICCA BRACELET,1,5.09,United Kingdom,5
90190C,SILVER/AMETHYST DROP EARRINGS LEAF,1,2.96,United Kingdom,5
90194,SILVER LARIAT BLACK STONE EARRINGS,1,4.24,United Kingdom,2
90209B,GREEN ENAMEL+GLASS HAIR COMB,1,2.11,United Kingdom,2
90214D,"LETTER ""D"" BLING KEY RING",1,0.85,United Kingdom,5
90214G,"LETTER ""G"" BLING KEY RING",1,0.85,United Kingdom,2
90214H,"LETTER ""H"" BLING KEY RING",1,0.85,United Kingdom,4
90214J,"LETTER ""J"" BLING KEY RING",1,0.85,United Kingdom,5
90214R,"LETTER ""R"" BLING KEY RING",1,0.85,United Kingdom,4
DOT,DOTCOM POSTAGE,1,569.77,United Kingdom,1
84534B,FAIRY CAKE NOTEBOOK A5 SIZE,2,1.66,United Kingdom,1
84535B,FAIRY CAKES NOTEBOOK A6 SIZE,1,1.49,United Kingdom,3
84536A,ENGLISH ROSE NOTEBOOK A7 SIZE,3,0.85,United Kingdom,0
84536B,FAIRY CAKES NOTEBOOK A7 SIZE,3,0.85,United Kingdom,5
84580,MOUSE TOY WITH PINK T-SHIRT,1,4.21,United Kingdom,4
84581,DOG TOY WITH PINK CROCHET SKIRT,1,4.21,United Kingdom,0
84598,BOYS ALPHABET IRON ON PATCHES,2,0.43,United Kingdom,4
84912B,GREEN ROSE WASHBAG,2,3.36,United Kingdom,5
84913A,SOFT PINK ROSE TOWEL ,1,3.36,United Kingdom,4
84913B,MINT GREEN ROSE TOWEL,3,3.36,United Kingdom,1
84923,PINK BUTTERFLY HANDBAG W BOBBLES,1,4.21,United Kingdom,1
84946,ANTIQUE SILVER TEA GLASS ETCHED,30,2.51,United Kingdom,2
84988,SET OF 72 PINK HEART PAPER DOILIES,1,2.98,United Kingdom,1
20856,DENIM PATCH PURSE PINK BUTTERFLY,6,1.65,United Kingdom,1
20854,BLUE PATCH PURSE PINK HEART,6,1.65,United Kingdom,2
21218,RED SPOTTY BISCUIT TIN,2,3.75,United Kingdom,4
22845,VINTAGE CREAM CAT FOOD CONTAINER,2,6.35,United Kingdom,3
11001,ASSTD DESIGN RACING CAR PEN,3,3.36,United Kingdom,5
16236,KITTY PENCIL ERASERS,1,0.43,United Kingdom,2
17003,BROCADE RING PURSE ,3,0.43,United Kingdom,2
17011F,ORIGAMI SANDLEWOOD INCENSE+FLOWER,1,4.21,United Kingdom,1
17012A,ORIGAMI VANILLA INCENSE/CANDLE SET ,3,2.51,United Kingdom,4
17012B,ORIGAMI JASMINE INCENSE/CANDLE SET,2,2.51,United Kingdom,1
17012C,ORIGAMI LAVENDER INCENSE/CANDL SET ,1,2.51,United Kingdom,4
17012D,ORIGAMI ROSE INCENSE/CANDLE SET ,1,2.51,United Kingdom,5
17012E,ORIGAMI OPIUM INCENSE/CANDLE SET ,1,2.51,United Kingdom,0
17012F,ORIGAMI SANDLEWOOD INCENSE/CAND SET,1,2.51,United Kingdom,3
17129F,BLUE GLASS GEMS IN BAG,2,1.66,United Kingdom,4
18098C,PORCELAIN BUTTERFLY OIL BURNER,2,5.91,United Kingdom,1
20622,VIPPASSPORT COVER ,1,4.21,United Kingdom,0
20658,RED RETROSPOT LUGGAGE TAG,1,2.51,United Kingdom,0
20662,FIRST CLASS HOLIDAY PURSE ,1,2.51,United Kingdom,2
20676,RED RETROSPOT BOWL,1,2.51,United Kingdom,2
20684,STRAWBERRY DREAM CHILDS UMBRELLA,1,6.77,United Kingdom,5
20719,WOODLAND CHARLOTTE BAG,2,1.66,United Kingdom,2
20724,RED RETROSPOT CHARLOTTE BAG,3,1.66,United Kingdom,5
20733,GOLD MINI TAPE MEASURE ,1,0.85,United Kingdom,3
20735,BLACK MINI TAPE MEASURE ,1,0.85,United Kingdom,2
20770,ABSTRACT CIRCLE JOURNAL ,4,2.51,United Kingdom,3
20835,FRENCH LATTICE CUSHION COVER ,1,11.02,United Kingdom,0
20839,FRENCH PAISLEY CUSHION COVER ,1,9.32,United Kingdom,3
20840,FRENCH FLORAL CUSHION COVER ,1,9.32,United Kingdom,4
20956,PORCELAIN T-LIGHT HOLDERS ASSORTED,1,2.51,United Kingdom,0
20969,RED FLORAL FELTCRAFT SHOULDER BAG,2,7.62,United Kingdom,3
20971,PINK BLUE FELT CRAFT TRINKET BOX,1,2.51,United Kingdom,2
20975,12 PENCILS SMALL TUBE RED RETROSPOT,1,1.28,United Kingdom,1
20981,12 PENCILS TALL TUBE WOODLAND,1,1.66,United Kingdom,1
20996,JAZZ HEARTS ADDRESS BOOK,1,0.84,United Kingdom,0
21000,ROSE DU SUD COSMETICS BAG,1,3.36,United Kingdom,5
21012,ANTIQUE ALL GLASS CANDLESTICK,2,2.51,United Kingdom,1
21069,VINTAGE BILLBOARD TEA MUG,1,2.51,United Kingdom,3
21070,VINTAGE BILLBOARD MUG ,1,2.51,United Kingdom,1
21147,JINGLE BELLS TREE DECORATION,2,2.51,United Kingdom,3
21158,MOODY GIRL DOOR HANGER ,2,3.36,United Kingdom,4
21165,BEWARE OF THE CAT METAL SIGN ,1,4.21,United Kingdom,3
21174,POTTERING IN THE SHED METAL SIGN,1,4.21,United Kingdom,4
21189,WHITE HONEYCOMB PAPER GARLAND ,4,3.36,United Kingdom,5
21191,LARGE WHITE HONEYCOMB PAPER BELL  ,6,4.21,United Kingdom,2
21195,PINK  HONEYCOMB PAPER BALL ,5,4.21,United Kingdom,0
21207,SKULL AND CROSSBONES  GARLAND ,2,3.36,United Kingdom,1
21216,"SET 3 RETROSPOT TEA,COFFEE,SUGAR",1,11.02,United Kingdom,4
21217,RED RETROSPOT ROUND CAKE TINS,1,21.23,United Kingdom,5
21231,SWEETHEART CERAMIC TRINKET BOX,4,2.51,United Kingdom,4
21238,RED RETROSPOT CUP,4,1.66,United Kingdom,1
21249,WOODLAND  HEIGHT CHART STICKERS ,1,5.91,United Kingdom,3
21262,WHITE GOOSE FEATHER CHRISTMAS TREE ,2,7.62,United Kingdom,0
21313,GLASS HEART T-LIGHT HOLDER ,2,1.66,United Kingdom,2
21349,IVY HEART WREATH,1,13.57,United Kingdom,0
21352,EUCALYPTUS & PINECONE  WREATH,2,5.91,United Kingdom,0
21354,TOAST ITS - BEST MUM,1,2.51,United Kingdom,4
21365,MIRRORED WALL ART STARS,1,5.91,United Kingdom,5
21366,MIRRORED WALL ART PHOTO FRAMES,1,8.47,United Kingdom,3
21369,MIRRORED WALL ART SPLODGES,1,7.62,United Kingdom,5
21372,MIRRORED WALL ART TABLE LAMP,1,5.91,United Kingdom,2
21385,IVORY HANGING DECORATION  HEART,2,1.66,United Kingdom,2
21407,BROWN CHECK CAT DOORSTOP ,2,8.47,United Kingdom,0
21408,SPOTTY PINK DUCK DOORSTOP,1,8.47,United Kingdom,5
21507,"ELEPHANT, BIRTHDAY CARD, ",1,0.85,United Kingdom,2
21563,RED HEART SHAPE LOVE BUCKET ,2,5.91,United Kingdom,5
21564,PINK  HEART SHAPE LOVE BUCKET ,2,5.91,United Kingdom,5
21634,ASSORTED MINI MADRAS NOTEBOOK,1,2.51,United Kingdom,3
21641,ASSORTED TUTTI FRUTTI KEYRING BALL,1,1.66,United Kingdom,0
21679,SKULLS  STICKERS,3,1.66,United Kingdom,4
21703,BAG 125g SWIRLY MARBLES,1,0.85,United Kingdom,2
21704,BAG 250g SWIRLY MARBLES,1,1.66,United Kingdom,5
21721,CANDY SHOP  STICKER SHEET,1,1.66,United Kingdom,2
21722,SWEET PUDDING STICKER SHEET,1,1.66,United Kingdom,4
21758,VINTAGE SHELLS PRINT,1,12.72,United Kingdom,4
22892,SET OF SALT AND PEPPER TOADSTOOLS,-7,1.25,Germany,3
22245,"HOOK, 1 HANGER ,MAGIC GARDEN",-2,0.85,Germany,4
20957,PORCELAIN HANGING BELL SMALL,-1,1.45,Germany,3
79144B,PAINTED LIGHTBULB STAR+ MOON,2,0.42,United Kingdom,3
22482,BLUE TEA TOWEL CLASSIC DESIGN,2,1.25,United Kingdom,5
21917,SET 12 KIDS  WHITE CHALK STICKS,1,0.42,United Kingdom,2
20697,LITTLE GREEN MONSTER SOFT TOY,1,2.55,United Kingdom,2
22599,CHRISTMAS MUSICAL ZINC STAR,12,0.85,United Kingdom,4
22597,CHRISTMAS MUSICAL ZINC HEART ,12,0.85,United Kingdom,5
21495,SKULLS AND CROSSBONES WRAP,25,0.42,United Kingdom,0
46000R,POLYESTER FILLER PAD 45x30cm,2,1.45,United Kingdom,4
46000S,POLYESTER FILLER PAD 40x40cm,1,1.45,United Kingdom,3
84920,PINK FLOWER FABRIC PONY,1,3.75,United Kingdom,3
22953,BIRTHDAY PARTY CORDON BARRIER TAPE,1,1.25,United Kingdom,5
84508A,CAMOUFLAGE DESIGN TEDDY,1,2.55,United Kingdom,3
21670,BLUE SPOT CERAMIC DRAWER KNOB,6,1.25,United Kingdom,5
22786,CUSHION COVER PINK UNION JACK,2,5.95,United Kingdom,2
22212,FOUR HOOK  WHITE LOVEBIRDS,1,2.1,United Kingdom,1
22678,FRENCH BLUE METAL DOOR SIGN 3,3,1.25,United Kingdom,5
22686,FRENCH BLUE METAL DOOR SIGN No,1,1.25,United Kingdom,4
84685,BEACH HUT KEY CABINET,1,3.75,United Kingdom,2
20616,CHERRY BLOSSOM PASSPORT COVER,2,2.1,United Kingdom,2
22753,SMALL YELLOW BABUSHKA NOTEBOOK ,9,0.85,United Kingdom,1
79066K,RETRO MOD TRAY,1,0.85,United Kingdom,2
22794,SWEETHEART WIRE MAGAZINE RACK,1,7.95,United Kingdom,3
22592,CARDHOLDER HOLLY WREATH METAL,1,3.75,United Kingdom,4
84352,SILVER CHRISTMAS TREE BAUBLE STAND ,1,16.95,United Kingdom,1
22795,SWEETHEART RECIPE BOOK STAND,2,6.75,United Kingdom,3
22278,OVERNIGHT BAG VINTAGE ROSE PAISLEY,1,4.95,United Kingdom,4
22802,FAUX FUR CHOCOLATE THROW,5,19.95,United Kingdom,1
84884A,ANT WHITE WIRE HEART SPIRAL,10,3.95,United Kingdom,2
51014C,"FEATHER PEN,COAL BLACK",24,0.85,United Kingdom,4
51014L,"FEATHER PEN,LIGHT PINK",12,0.85,United Kingdom,5
51014A,"FEATHER PEN,HOT PINK",12,0.85,United Kingdom,4
22366,DOORMAT AIRMAIL ,10,6.75,United Kingdom,4
48111,DOORMAT 3 SMILEY CATS,10,6.75,United Kingdom,4
22846,BREAD BIN DINER STYLE RED ,4,14.95,United Kingdom,2
22402,MAGNETS PACK OF 4 VINTAGE COLLAGE,12,1.25,United Kingdom,3
22400,MAGNETS PACK OF 4 HOME SWEET HOME,12,1.25,United Kingdom,4
22399,MAGNETS PACK OF 4 CHILDHOOD MEMORY,12,1.25,United Kingdom,5
79302M,"ART LIGHTS,FUNK MONKEY",6,2.95,United Kingdom,4
37446,MINI CAKE STAND WITH HANGING CAKES,8,1.45,United Kingdom,0
84509B,SET OF 4 FAIRY CAKE PLACEMATS,4,3.75,United Kingdom,2
22313,OFFICE MUG WARMER PINK,6,2.95,United Kingdom,2
21181,PLEASE ONE PERSON METAL SIGN,12,2.1,United Kingdom,5
21818,GLITTER CHRISTMAS HEART ,36,0.85,United Kingdom,3
21668,RED STRIPE CERAMIC DRAWER KNOB,6,1.25,United Kingdom,3
21462,"NURSERY A,B,C PAINTED LETTERS",1,6.75,United Kingdom,1
22496,SET OF 2 ROUND TINS DUTCH CHEESE,1,2.95,United Kingdom,2
84870C,GREEN GEISHA GIRL ,1,3.75,United Kingdom,5
84870B,BLUE GEISHA GIRL ,1,3.75,United Kingdom,0
22765,NEWSPAPER STAND,1,14.95,United Kingdom,2
21351,CINAMMON & ORANGE WREATH,2,6.75,United Kingdom,5
22581,WOOD STOCKING CHRISTMAS SCANDISPOT,3,0.85,United Kingdom,1
22579,WOODEN TREE CHRISTMAS SCANDINAVIAN,1,0.85,United Kingdom,3
22572,ROCKING HORSE GREEN CHRISTMAS ,1,0.85,United Kingdom,4
22640,SET OF 4 NAPKIN CHARMS 3 KEYS ,1,2.55,United Kingdom,5
22641,SET OF 4 NAPKIN CHARMS INSTRUMENT,2,2.55,United Kingdom,0
22638,SET OF 4 NAPKIN CHARMS CROWNS ,1,2.55,United Kingdom,5
22576,SWALLOW WOODEN CHRISTMAS DECORATION,3,0.85,United Kingdom,2
21817,GLITTER CHRISTMAS TREE,1,0.85,United Kingdom,0
21813,GARLAND WITH STARS AND BELLS,1,4.95,United Kingdom,0
21808,"CHRISTMAS GARLAND STARS,TREES",1,3.75,United Kingdom,0
21014,SWISS CHALET TREE DECORATION ,2,0.85,United Kingdom,5
21018,BIRD BOX CHRISTMAS TREE DECORATION,2,0.85,United Kingdom,4
22946,WOODEN ADVENT CALENDAR CREAM,1,16.95,United Kingdom,2
M,Manual,1,1.25,United Kingdom,3
22660,DOORMAT I LOVE LONDON,1,7.95,United Kingdom,2
21761,WOOD AND GLASS MEDICINE CABINET,1,29.95,United Kingdom,0
21781,MA CAMPAGNE CUTLERY BOX,2,14.95,United Kingdom,2
22696,WICKER WREATH LARGE,6,1.95,United Kingdom,1
84360,TABLE LAMP WHITE SHADE WOOD BASE,2,5.95,United Kingdom,1
35954,SMALL FOLKART STAR CHRISTMAS DEC,48,0.42,United Kingdom,0
84760S,SMALL HANGING GLASS+ZINC LANTERN,12,1.45,United Kingdom,4
85045,GREEN CHRISTMAS TREE STRING 20LIGHT,4,4.95,United Kingdom,2
35598B,BLACK CHRISTMAS TREE 60CM,24,0.65,United Kingdom,2
22578,WOODEN STAR CHRISTMAS SCANDINAVIAN,24,0.85,United Kingdom,3
22855,FINE WICKER HEART ,12,1.25,United Kingdom,4
21864,UNION JACK FLAG PASSPORT COVER ,72,1.69,United Kingdom,4
15056P,EDWARDIAN PARASOL PINK,48,4.6,United Kingdom,3
85174,S/4 CACTI CANDLES,16,4.25,United Kingdom,0
82615,PINK MARSHMALLOW SCARF KNITTING KIT,36,2.55,United Kingdom,4
85038,6 CHOCOLATE LOVE HEART T-LIGHTS,72,1.69,United Kingdom,5
22965,3 TRADITIONAL COOKIE CUTTERS  SET,6,2.1,United Kingdom,2
22972,CHILDRENS SPACEBOY MUG,12,1.65,United Kingdom,1
21374,MIRRORED WALL ART SKULLS,4,3.75,United Kingdom,1
21509,COWBOYS AND INDIANS BIRTHDAY CARD ,12,0.42,United Kingdom,3
22025,RING OF ROSES BIRTHDAY CARD,12,0.42,United Kingdom,5
22725,ALARM CLOCK BAKELIKE CHOCOLATE,4,3.75,United Kingdom,2
37448,CERAMIC CAKE DESIGN SPOTTED MUG,12,1.49,United Kingdom,1
22421,LIPSTICK PEN FUSCHIA,12,0.42,United Kingdom,0
84997A,GREEN 3 PIECE POLKADOT CUTLERY SET,6,3.75,United Kingdom,0
21136,PAINTED METAL PEARS ASSORTED,8,1.69,United Kingdom,5
71477,COLOUR GLASS. STAR T-LIGHT HOLDER,4,3.25,United Kingdom,2
22030,SWALLOWS GREETING CARD,12,0.42,United Kingdom,1
90214M,"LETTER ""M"" BLING KEY RING",1,1.25,United Kingdom,0
90214V,"LETTER ""V"" BLING KEY RING",1,1.25,United Kingdom,0
90214S,"LETTER ""S"" BLING KEY RING",1,1.25,United Kingdom,2
21789,KIDS RAIN MAC PINK,1,0.85,United Kingdom,5
21629,SQUARE FLOOR CUSHION VINTAGE RED,1,7.95,United Kingdom,4
21850,BLUE  DIAMANTE PEN IN GIFT BOX,1,4.95,United Kingdom,3
20978,36 PENCILS TUBE SKULLS,2,1.25,United Kingdom,3
20768,GREEN FERN JOURNAL ,1,2.55,United Kingdom,3
20780,BLACK EAR MUFF HEADPHONES,1,5.49,United Kingdom,3
21398,RED POLKADOT COFFEE  MUG,1,2.1,United Kingdom,1
21643,ASSORTED TUTTI FRUTTI MIRROR,3,1.25,United Kingdom,1
21620,SET OF 4 ROSE BOTANICAL CANDLES,1,3.75,United Kingdom,1
22260,FELT EGG COSY BLUE RABBIT ,5,0.85,United Kingdom,0
22136,LOVE HEART SOCK HANGER,1,1.65,United Kingdom,0
16168M,FUNKY MONKEY GIFT BAG MEDIUM,2,0.85,United Kingdom,2
17014A,ORIGAMI VANILLA INCENSE CONES,1,3.36,United Kingdom,4
17084N,FAIRY DREAMS INCENSE ,2,0.43,United Kingdom,0
17084P,DRAGONS BLOOD INCENSE,1,0.43,United Kingdom,2
20617,FIRST CLASS PASSPORT COVER ,1,4.21,United Kingdom,3
20619,TROPICAL PASSPORT COVER ,1,4.21,United Kingdom,5
20653,CHERRY BLOSSOM LUGGAGE TAG,1,2.51,United Kingdom,0
20681,PINK POLKADOT CHILDRENS UMBRELLA,1,6.77,United Kingdom,5
20682,RED RETROSPOT CHILDRENS UMBRELLA,2,6.77,United Kingdom,3
20696,FLORAL SOFT CAR TOY,1,7.62,United Kingdom,0
20699,MOUSEY LONG LEGS SOFT TOY,2,5.06,United Kingdom,3
20700,GREEN CAT FLORAL CUSHION COVER ,1,10.17,United Kingdom,5
20718,RED RETROSPOT SHOPPER BAG,1,2.51,United Kingdom,2
20752,BLUE POLKADOT WASHING UP GLOVES,1,4.21,United Kingdom,1
20761,BLUE PAISLEY SKETCHBOOK,1,7.62,United Kingdom,2
20846,ZINC HEART LATTICE T-LIGHT HOLDER,1,2.51,United Kingdom,2
20931,BLUE POT PLANT CANDLE ,2,7.62,United Kingdom,4
21002,ROSE DU SUD DRAWSTRING BAG,2,3.36,United Kingdom,3
21015,DARK BIRD HOUSE TREE DECORATION,1,1.28,United Kingdom,1
21067,VINTAGE RED TEATIME MUG,1,2.51,United Kingdom,1
21109,"LARGE CAKE TOWEL, CHOCOLATE SPOTS",1,13.57,United Kingdom,4
21110,LARGE CAKE TOWEL PINK SPOTS,2,13.57,United Kingdom,3
21128,GOLD FISHING GNOME,1,12.72,United Kingdom,3
21164,HOME SWEET HOME METAL SIGN ,1,5.91,United Kingdom,2
21188,3D HEARTS  HONEYCOMB PAPER GARLAND,2,5.91,United Kingdom,3
21208,PASTEL COLOUR HONEYCOMB FAN,1,3.36,United Kingdom,0
21220,SET/4 BADGES DOGS,1,2.51,United Kingdom,1
21272,SALLE DE BAIN HOOK,1,2.51,United Kingdom,4
21279,VINTAGE KITCHEN PRINT FRUITS,1,5.06,United Kingdom,2
21281,VINTAGE KITCHEN PRINT SEAFOOD,1,5.06,United Kingdom,0
21288,STRIPEY CHOCOLATE NESTING BOXES,1,5.91,United Kingdom,0
21356,TOAST ITS - FAIRY FLOWER,1,2.51,United Kingdom,1
21439,BASKET OF TOADSTOOLS,1,2.51,United Kingdom,0
21447,12 IVORY ROSE PEG PLACE SETTINGS,1,2.51,United Kingdom,1
21537,RED RETROSPOT PUDDING BOWL,2,8.47,United Kingdom,4
21547,CERAMIC BIRDHOUSE CRESTED TIT SMALL,1,5.91,United Kingdom,3
21594,Dr. Jam's Arouzer Stress Ball,1,4.21,United Kingdom,0
21638,ASSORTED TUTTI FRUTTI NOTEBOOK,1,4.21,United Kingdom,3
21648,ASSORTED TUTTI FRUTTI SMALL PURSE,3,2.51,United Kingdom,4
21656,RIDGED GLASS POSY VASE ,1,3.36,United Kingdom,4
21671,RED SPOT CERAMIC DRAWER KNOB,2,2.51,United Kingdom,4
21684,SMALL MEDINA STAMPED METAL BOWL ,1,2.51,United Kingdom,1
21698,MOCK LOBSTER FRIDGE MAGNET,1,1.66,United Kingdom,0
21700,BIG DOUGHNUT FRIDGE MAGNETS,1,8.47,United Kingdom,4
21745,GAOLERS KEYS DECORATIVE GARDEN ,1,8.47,United Kingdom,2
21775,DECORATIVE FLORE BATHROOM BOTTLE,3,2.51,United Kingdom,4
21820,GLITTER HEART GARLAND WITH BELLS ,1,7.62,United Kingdom,0
21830,ASSORTED CREEPY CRAWLIES,1,0.85,United Kingdom,4
21846,PINK DIAMANTE PEN IN GIFT BOX,4,4.21,United Kingdom,4
21868,POTTING SHED TEA MUG,2,3.36,United Kingdom,5
21875,KINGS CHOICE MUG,1,3.36,United Kingdom,4
21896,POTTING SHED TWINE,1,4.21,United Kingdom,1
21899,"KEY FOB , GARAGE DESIGN",1,1.66,United Kingdom,4
21906,PHARMACIE FIRST AID TIN,1,13.57,United Kingdom,1
21908,CHOCOLATE THIS WAY METAL SIGN,1,4.21,United Kingdom,2
21974,SET OF 36 PAISLEY FLOWER DOILIES,5,2.98,United Kingdom,5
22078,RIBBON REEL LACE DESIGN ,1,4.21,United Kingdom,5
22084,PAPER CHAIN KIT EMPIRE,1,5.91,United Kingdom,2
22091,EMPIRE TISSUE BOX,2,2.51,United Kingdom,2
22124,SET OF 2 TEA TOWELS PING MICROWAVE,2,2.51,United Kingdom,4
22165,"DIAMANTE HEART SHAPED WALL MIRROR, ",1,11.02,United Kingdom,4
22184,CAKE STAND VICTORIAN FILIGREE LARGE,1,8.47,United Kingdom,1
22208,WOOD STAMP SET THANK YOU,1,3.36,United Kingdom,5
22246,MAGIC GARDEN FELT GARLAND ,2,4.21,United Kingdom,4
22283,6 EGG HOUSE PAINTED WOOD,1,16.13,United Kingdom,2
22304,COFFEE MUG BLUE PAISLEY DESIGN,1,5.06,United Kingdom,4
22308,TEA COSY BLUE STRIPE,1,5.06,United Kingdom,0
22317,FIVE CATS HANGING DECORATION,2,5.91,United Kingdom,4
22324,BLUE POLKADOT KIDS BAG,1,4.21,United Kingdom,5
22325,MOBILE VINTAGE HEARTS ,1,11.87,United Kingdom,0
22331,WOODLAND PARTY BAG + STICKER SET,1,3.36,United Kingdom,2
22342,HOME GARLAND PAINTED ZINC ,1,3.36,United Kingdom,0
22350,ILLUSTRATED CAT BOWL ,2,5.06,United Kingdom,5
22393,PAPERWEIGHT VINTAGE COLLAGE,1,5.06,United Kingdom,4
22405,MONEY BOX POCKET MONEY DESIGN,1,2.51,United Kingdom,1
22409,MONEY BOX BISCUITS DESIGN,1,2.51,United Kingdom,1
22420,LIPSTICK PEN BABY PINK,2,0.85,United Kingdom,5
22425,ENAMEL COLANDER CREAM,1,10.17,United Kingdom,5
22458,CAST IRON HOOK GARDEN FORK,1,5.06,United Kingdom,1
22459,CAST IRON HOOK GARDEN TROWEL,1,5.06,United Kingdom,1
22499,WOODEN UNION JACK BUNTING,1,12.72,United Kingdom,0
22503,CABIN BAG VINTAGE PAISLEY,1,59.53,United Kingdom,5
22536,MAGIC DRAWING SLATE PURDEY,1,0.85,United Kingdom,0
22586,FELTCRAFT HAIRBAND PINK AND BLUE,1,1.66,United Kingdom,3
22602,CHRISTMAS RETROSPOT HEART WOOD,1,1.66,United Kingdom,5
22649,STRAWBERRY FAIRY CAKE TEAPOT,2,11.02,United Kingdom,2
22668,PINK BABY BUNTING,1,5.91,United Kingdom,2
22673,FRENCH GARDEN SIGN BLUE METAL,1,2.51,United Kingdom,5
22692,DOORMAT WELCOME TO OUR HOME,1,7.95,United Kingdom,5
22746,POPPY'S PLAYHOUSE LIVINGROOM ,2,4.21,United Kingdom,3
22747,POPPY'S PLAYHOUSE BATHROOM,1,4.21,United Kingdom,3
22756,LARGE YELLOW BABUSHKA NOTEBOOK ,1,2.51,United Kingdom,3
22788,BROCANTE COAT RACK,1,20.38,United Kingdom,5
22831,WHITE BROCANTE SOAP DISH,1,5.91,United Kingdom,4
22841,ROUND CAKE TIN VINTAGE GREEN,1,16.13,United Kingdom,0
22863,SOAP DISH BROCANTE,1,5.91,United Kingdom,4
22870,NUMBER TILE COTTAGE GARDEN 2,1,4.21,United Kingdom,5
22890,NOVELTY BISCUITS CAKE STAND 3 TIER,1,20.38,United Kingdom,3
22897,OVEN MITT APPLES DESIGN,1,2.98,United Kingdom,1
22898,CHILDRENS APRON APPLES DESIGN,2,4.21,United Kingdom,0
22944,CHRISTMAS METAL POSTCARD WITH BELLS,1,16.13,United Kingdom,0
22977,DOLLY GIRL CHILDRENS EGG CUP,1,2.51,United Kingdom,4
35637A,IVORY STRING CURTAIN WITH POLE ,1,19.53,United Kingdom,0
35916B,BLUE FELT HANGING HEART W FLOWER,1,1.66,United Kingdom,1
35916C,PINK FELT HANGING HEART W FLOWER,1,1.66,United Kingdom,0
35964,FOLKART CLIP ON STARS,1,1.66,United Kingdom,2
35965,FOLKART HEART NAPKIN RINGS,4,3.36,United Kingdom,1
35967,FOLK ART METAL STAR T-LIGHT HOLDER,3,1.66,United Kingdom,4
37450,CERAMIC CAKE BOWL + HANGING CAKES,1,5.91,United Kingdom,4
37491A,YELLOW/PINK CERAMIC CANDLE HOLDER,1,3.36,United Kingdom,5
46775D,SUNSET COLOUR CHUNKY KNITTED THROW,1,11.02,United Kingdom,5
46776B,WOVEN BERRIES CUSHION COVER ,1,4.21,United Kingdom,3
47566B,TEA TIME PARTY BUNTING,1,8.47,United Kingdom,4
47567B,TEA TIME KITCHEN APRON,1,12.72,United Kingdom,2
47590A,BLUE HAPPY BIRTHDAY BUNTING,1,11.02,United Kingdom,0
47590B,PINK HAPPY BIRTHDAY BUNTING,1,11.02,United Kingdom,2
47594A,CAROUSEL DESIGN WASHBAG,1,4.21,United Kingdom,0
70006,LOVE HEART POCKET WARMER,2,3.36,United Kingdom,2
71496A,A4 WALL TIDY BLUE OFFICE,2,1.49,United Kingdom,1
72134,COLUMBIAN  CUBE CANDLE ,1,1.66,United Kingdom,4
79067,CORONA MEXICAN TRAY,1,8.47,United Kingdom,2
82582,AREA PATROLLED METAL SIGN,1,4.21,United Kingdom,1
82599,FANNY'S REST STOPMETAL SIGN,2,4.21,United Kingdom,2
82616C,MIDNIGHT GLAMOUR SCARF KNITTING KIT,1,2.51,United Kingdom,1
84459B,YELLOW METAL CHICKEN HEART ,1,3.36,United Kingdom,1
84520B,PACK 20 ENGLISH ROSE PAPER NAPKINS,2,1.66,United Kingdom,3
84559A,3D SHEET OF DOG STICKERS,1,1.69,United Kingdom,2
84559B,3D SHEET OF CAT STICKERS,1,1.69,United Kingdom,2
84596J,MIXED NUTS LIGHT GREEN BOWL,1,2.51,United Kingdom,2
84609,TALL ROCOCO CANDLE HOLDER,1,16.98,United Kingdom,3
84659A,WHITE TRAVEL ALARM CLOCK,3,2.51,United Kingdom,2
84663A,GRASS HOPPER WOODEN WALL CLOCK ,1,5.91,United Kingdom,2
84828,JUNGLE POPSICLES ICE LOLLY HOLDERS,2,2.51,United Kingdom,3
84856L,LARGE TAHITI BEACH BAG,1,11.87,United Kingdom,2
84915,HAND TOWEL PINK FLOWER AND DAISY,2,4.21,United Kingdom,3
84950,ASSORTED COLOUR T-LIGHT HOLDER,18,0.99,United Kingdom,1
84976,RECTANGULAR SHAPED MIRROR,1,3.36,United Kingdom,4
85008,SET OF 3 CONEY ISLAND OVAL BOXES,1,10.17,United Kingdom,5
85040B,SET/4 BLUE FLOWER CANDLES IN BOWL,2,3.36,United Kingdom,5
85053,FRENCH ENAMEL CANDLEHOLDER,1,4.21,United Kingdom,1
85114A,BLACK ENCHANTED FOREST PLACEMAT,4,3.36,United Kingdom,5
85131D,BEADED CRYSTAL HEART PINK ON STICK,1,0.85,United Kingdom,0
85170D,SET/6 PINK BIRD T-LIGHT CANDLES,1,4.21,United Kingdom,0
85212,MINI PAINTED GARDEN DECORATION ,4,1.66,United Kingdom,3
85227,SET OF 6 3D KIT CARDS FOR KIDS,2,1.66,United Kingdom,4
85232D,SET/3 DECOUPAGE STACKING TINS,1,10.17,United Kingdom,5
90013B,BLACK VINTAGE EARRINGS,1,4.24,United Kingdom,0
90018B,GOLD M.O.P ORBIT DROP EARRINGS,1,4.24,United Kingdom,5
90019B,GOLD M.O.P ORBIT BRACELET,1,5.51,United Kingdom,0
90024C,NEW BAROQUE B'FLY NECKLACE GREEN,1,8.49,United Kingdom,4
90036F,"FLOWER GLASS GARLD NECKL36""TURQUOIS",1,8.07,United Kingdom,3
90040B,MURANO STYLE GLASS BRACELET BLACK,1,3.81,United Kingdom,0
90051,CRACKED GLAZE NECKLACE RED,1,7.22,United Kingdom,2
90054,CRACKED GLAZE EARRINGS RED,1,2.54,United Kingdom,4
90077,BLACK DIAMOND CLUSTER EARRINGS,1,2.96,United Kingdom,3
90124B,BLUE MURANO TWIST NECKLACE,1,10.17,United Kingdom,2
90134,OLD ROSE COMBO BEAD NECKLACE,1,2.96,United Kingdom,4
90138,WHITE/PINK MINI CRYSTALS NECKLACE,1,5.51,United Kingdom,5
90161B,ANT COPPER TURQ BOUDICCA BRACELET,2,5.09,United Kingdom,4
90166,PINK & WHITE ROSEBUD RING,1,4.24,United Kingdom,3
90173,PAIR BUTTERFLY HAIR CLIPS,1,3.81,United Kingdom,0
90177C,DROP DIAMANTE EARRINGS CRYSTAL,1,2.96,United Kingdom,0
90177E,DROP DIAMANTE EARRINGS GREEN,1,2.96,United Kingdom,0
90181B,AMETHYST GLASS/SHELL/PEARL NECKLACE,1,9.34,United Kingdom,5
90192,JADE DROP EARRINGS W FILIGREE,1,5.09,United Kingdom,4
90206C,CRYSTAL DIAMANTE STAR BROOCH,1,5.09,United Kingdom,2
90209C,PINK ENAMEL+GLASS HAIR COMB,1,2.11,United Kingdom,1
90211A,DIAMOND LAS VEGAS NECKLACE 45CM,1,5.94,United Kingdom,4
