StockCode,Description,Quantity,UnitPrice,Country,Rating
21933,PINK VINTAGE PAISLEY PICNIC BAG,2,2.95,United Kingdom,5
37489A,YELLOW/PINK FLOWER DESIGN BIG MUG,1,1.95,United Kingdom,4
22072,RED RETROSPOT TEA CUP AND SAUCER ,4,3.75,United Kingdom,1
21905,MORE BUTTER METAL SIGN ,6,2.1,United Kingdom,5
22414,DOORMAT NEIGHBOURHOOD WITCH ,2,7.95,United Kingdom,3
22116,METAL SIGN HIS DINNER IS SERVED,4,2.95,United Kingdom,0
85130A,BEADED PEARL HEART WHITE LARGE,24,1.65,United Kingdom,2
85129C,BEADED CRYSTAL HEART BLUE SMALL,24,1.25,United Kingdom,5
22246,"GARLAND, MAGIC GARDEN 1.8M",12,1.95,EIRE,1
84849A,HELLO SAILOR BLUE SOAP HOLDER,12,1.69,EIRE,2
22137,BATHROOM SET LOVE HEART DESIGN,1,2.95,United Kingdom,4
85230B,CINNAMON SCENTED VOTIVE CANDLE,24,0.29,United Kingdom,5
85230F,JASMINE VOTIVE CANDLE,24,0.29,United Kingdom,2
22306,SILVER MUG BONE CHINA TREE OF LIFE,24,1.95,United Kingdom,4
20734,SILVER MINI TAPE MEASURE ,2,2.51,United Kingdom,4
20960,WATERMELON BATH SPONGE,4,2.51,United Kingdom,4
35970,ZINC FOLKART SLEIGH BELLS,13,4.21,United Kingdom,4
84849D,HOT BATHS SOAP HOLDER,12,1.69,Germany,4
84507C,BLUE CIRCLES DESIGN MONKEY DOLL,1,2.55,United Kingdom,5
20910,VINTAGE PHOTO ALBUM PARIS DAYS,2,6.35,United Kingdom,5
82616B,FRAPPUCINO SCARF KNITTING KIT,1,2.95,United Kingdom,2
90128B,BLUE LEAVES AND BEADS PHONE CHARM,1,1.25,United Kingdom,2
90196B,BLACK GEMSTONE NECKLACE 45CM,1,12.75,United Kingdom,2
90198B,VINTAGE ROSE BEAD BRACELET BLACK,1,4.25,United Kingdom,4
90152B,BLUE/GREEN SHELL NECKLACE W PENDANT,1,5.95,United Kingdom,1
90151,SILVER/NATURAL SHELL NECKLACE,1,8.5,United Kingdom,1
20661,BLUE POLKADOT PURSE ,1,2.95,United Kingdom,5
20652,BLUE POLKADOT LUGGAGE TAG ,2,1.25,United Kingdom,3
21845,DAIRY MAID STRIPE MUG,6,2.95,United Kingdom,2
22398,MAGNETS PACK OF 4 SWALLOWS,1,1.25,United Kingdom,4
84877D,BLUE ROUND COMPACT MIRROR,1,3.75,United Kingdom,4
20657,TROPICAL LUGGAGE TAG,1,1.25,United Kingdom,5
47422,ASSORTED MONKEY SUCTION CUP HOOK,1,0.42,United Kingdom,2
21642,ASSORTED TUTTI FRUTTI PEN,2,0.85,United Kingdom,1
47503H,ASS FLORAL PRINT SPIRIT LEVEL ,1,1.95,United Kingdom,5
72130,COLUMBIAN CANDLE ROUND,1,0.65,United Kingdom,5
47343A,FUSCHIA FLOWER PURSE WITH BEADS,3,1.49,United Kingdom,5
72802A,ROSE SCENT CANDLE IN JEWELLED BOX,1,4.25,United Kingdom,2
72802B,OCEAN SCENT CANDLE IN JEWELLED BOX,2,4.25,United Kingdom,1
21054,NURSE'S BAG SOFT TOY,1,8.95,United Kingdom,0
22339,CHRISTMAS TREE PAINTED ZINC ,3,0.65,United Kingdom,3
22337,ANGEL DECORATION PAINTED ZINC ,4,0.65,United Kingdom,1
84562A,PINK/WHITE RIBBED MELAMINE JUG,1,7.95,United Kingdom,1
21040,MODERN VINTAGE COTTON SHOPPING BAG,1,2.55,United Kingdom,3
21937,STRAWBERRY   PICNIC BAG,1,2.95,United Kingdom,1
22701,PINK DOG BOWL,1,2.95,United Kingdom,4
22362,GLASS JAR PEACOCK BATH SALTS,1,2.95,United Kingdom,3
82011C,BATHROOM SCALES FOOTPRINTS IN SAND,1,3.75,United Kingdom,1
84865,NEW BAROQUE BLACK PHOTO ALBUM,1,8.5,United Kingdom,0
21287,SCENTED VELVET LOUNGE CANDLE ,12,1.25,Italy,2
79337,BLUE FLOCK GLASS CANDLEHOLDER,6,1.65,Italy,3
85111,SILVER GLITTER FLOWER VOTIVE HOLDER,12,1.25,Italy,1
22307,GOLD MUG BONE CHINA TREE OF LIFE,6,1.95,Italy,4
85078,SCANDINAVIAN 3 HEARTS NAPKIN RING,24,0.65,Italy,1
85034C,3 ROSE MORRIS BOXED CANDLES,4,4.25,Italy,5
84614A,PINK BAROQUE FLOCK CANDLE HOLDER,2,5.95,Italy,3
22509,SEWING BOX RETROSPOT DESIGN ,1,16.95,United Kingdom,5
90145,SILVER HOOP EARRINGS WITH FLOWER,1,5.95,United Kingdom,5
90143,SILVER BRACELET W PASTEL FLOWER,1,7.5,United Kingdom,1
90010A,MIDNIGHT BLUE GLASS/SILVER BRACELET,1,8.95,United Kingdom,0
90010B,BLACK/WHITE GLASS/SILVER BRACELET,1,8.95,United Kingdom,2
90050,CRACKED GLAZE NECKLACE IVORY,1,6.95,United Kingdom,4
90053,CRACKED GLAZE EARRINGS IVORY,1,2.55,United Kingdom,1
21275,?,-30,0.0,United Kingdom,1
20829,GLITTER HANGING BUTTERFLY STRING,8,2.1,United Kingdom,4
21947,SET OF 6 HEART CHOPSTICKS,12,1.25,United Kingdom,4
21726,MULTI HEARTS  STICKERS,12,0.85,United Kingdom,4
22671,FRENCH LAUNDRY SIGN BLUE METAL,1,1.65,United Kingdom,1
20936,FORKED CACTUS CANDLE,-1,2.95,United Kingdom,4
84924A,WAKE UP COCKEREL CALENDAR SIGN ,1,3.75,United Kingdom,1
35810B,ENAMEL BLUE RIM COFFEE CONTAINER,1,2.1,United Kingdom,5
35241,ENAMEL BLUE RIM BISCUIT BIN,1,4.95,United Kingdom,2
17109D,FLOWER FAIRY INCENSE BOUQUET,2,1.69,United Kingdom,3
21011,GLITTER SNOW PEAR TREE DECORATION,2,1.45,United Kingdom,2
22853,CAT BOWL VINTAGE CREAM,1,3.25,United Kingdom,4
85034B,3 WHITE CHOC MORRIS BOXED CANDLES,4,4.25,United Kingdom,1
72800D,4 BLUE DINNER CANDLES SILVER FLOCK,12,2.55,United Kingdom,4
84819,DANISH ROSE ROUND SEWING BOX,3,4.25,United Kingdom,3
90185D,CRYSTAL DIAMANTE EXPANDABLE RING,1,4.25,United Kingdom,0
90175A,WHITE GLASS CHUNKY CHARM BRACELET,1,8.95,United Kingdom,5
22079,RIBBON REEL HEARTS DESIGN ,1,1.65,United Kingdom,4
90162B,ANT SILVER LIME GREEN BOUDICCA RING,1,2.95,United Kingdom,1
90162D,ANT SILVER PURPLE BOUDICCA RING,1,2.95,United Kingdom,0
21626,VINTAGE UNION JACK PENNANT,12,1.95,United Kingdom,5
90167,BEADED LOVE HEART JEWELLERY SET,10,0.85,United Kingdom,3
22403,MAGNETS PACK OF 4 VINTAGE LABELS ,12,1.25,United Kingdom,4
22563,HAPPY STENCIL CRAFT,5,1.25,United Kingdom,3
84827,ASS DES PHONE SPONGE CRAFT STICKER,60,0.65,United Kingdom,4
22799,SWEETHEART WIRE FRUIT BOWL,1,8.5,United Kingdom,4
22305,COFFEE MUG PINK PAISLEY DESIGN,6,2.55,United Kingdom,2
84898F,YELLOW FLOWERS FELT HANDBAG KIT,2,2.1,United Kingdom,5
22415,WHITE TISSUE REAM,1,7.95,United Kingdom,5
22256,FELT FARM ANIMAL CHICKEN,3,1.25,United Kingdom,4
47310M,"SMALL POP BOX,FUNKY MONKEY",1,1.25,United Kingdom,5
84508B,STRIPES DESIGN TEDDY,1,2.55,United Kingdom,5
21555,CERAMIC STRAWBERRY TRINKET TRAY,6,2.55,France,1
22390,PAPERWEIGHT CHILDHOOD MEMORIES,6,2.55,France,4
84963A,PINK PAINTED KASHMIRI CHAIR,4,42.95,France,5
84993B,75 BLACK PETIT FOUR CASES,12,0.42,United Kingdom,1
85206A,CREAM FELT EASTER EGG BASKET,24,1.65,Lithuania,4
22021,BLUE FELT EASTER EGG BASKET,24,1.65,Lithuania,4
84596G,SMALL CHOCOLATES PINK BOWL,1,1.25,United Kingdom,4
21445,12 PINK ROSE PEG PLACE SETTINGS,4,1.25,United Kingdom,2
77101A,UNION FLAG WINDSOCK,4,1.25,United Kingdom,4
84358,FLOOR LAMP SHADE WOOD BASE,1,9.95,United Kingdom,1
21294,ETCHED GLASS COASTER,48,1.25,United Kingdom,1
21468,BUTTERFLY CROCHET FOOD COVER,1,3.75,United Kingdom,1
22123,PING MICROWAVE APRON,1,5.95,United Kingdom,2
22939,APRON APPLE DELIGHT,2,4.95,United Kingdom,4
21836,GINGHAM OVEN GLOVE RED HEART ,1,3.75,United Kingdom,4
71279,PINK GLASS CANDLEHOLDER,-2,2.95,United Kingdom,5
22598,CHRISTMAS MUSICAL ZINC TREE,4,0.85,United Kingdom,4
22532,MAGIC DRAWING SLATE LEAP FROG ,1,0.42,United Kingdom,2
21413,PERIWINKLE T-LIGHT HOLDER,1,1.25,United Kingdom,4
79149B,SILICON STAR BULB  BLUE,1,0.42,United Kingdom,4
21682,LARGE MEDINA STAMPED METAL BOWL ,4,4.95,United Kingdom,0
78034B,BLUE NETTING STORAGE HANGER,1,1.95,United Kingdom,4
22894,TABLECLOTH RED APPLES DESIGN ,1,8.5,United Kingdom,5
79151B,"SILICON CUBE 25W, BLUE",1,0.42,United Kingdom,5
21090,SET/6 COLLAGE PAPER PLATES,2,0.85,United Kingdom,0
21209,MULTICOLOUR HONEYCOMB FAN,1,1.65,United Kingdom,5
22354,RETROSPOT PADDED SEAT CUSHION,4,3.75,United Kingdom,2
21635,MADRAS NOTEBOOK LARGE ,1,3.75,United Kingdom,1
35653,VINTAGE BEAD NOTEBOOK,5,2.95,United Kingdom,2
85130D,BEADED CRYSTAL HEART PINK LARGE,5,1.65,United Kingdom,0
15039,SANDALWOOD FAN,3,0.85,United Kingdom,1
84978,HANGING HEART JAR T-LIGHT HOLDER,6,1.25,United Kingdom,4
84569D,PACK 6 HEART/ICE-CREAM PATCHES,6,1.25,United Kingdom,0
84921,CREAM AND PINK FLOWERS PONY ,1,3.75,United Kingdom,1
84508C,BLUE CIRCLES DESIGN TEDDY,4,2.55,United Kingdom,4
90086,CRYSTAL FROG PHONE CHARM,1,0.85,United Kingdom,2
62018,SOMBRERO ,1,1.95,United Kingdom,1
16011,ANIMAL STICKERS,5,0.21,United Kingdom,4
85179A,GREEN BITTY LIGHT CHAIN,1,4.65,United Kingdom,4
21785,RAIN PONCHO ,1,0.85,United Kingdom,5
21650,ASSORTED TUTTI FRUTTI BRACELET,2,0.65,United Kingdom,5
84874B,BLUE TRAVEL FIRST AID KIT,1,1.65,United Kingdom,1
22674,FRENCH TOILET SIGN BLUE METAL,1,1.25,United Kingdom,2
72051S,BAG OF SILVER STONES,4,0.42,United Kingdom,5
20764,ABSTRACT CIRCLES SKETCHBOOK ,1,3.75,United Kingdom,5
47579,TEA TIME BREAKFAST BASKET,1,2.1,United Kingdom,4
21723,ALPHABET HEARTS STICKER SHEET,1,0.85,United Kingdom,5
35953,FOLKART STAR CHRISTMAS DECORATIONS,24,1.25,United Kingdom,4
84051,ASS COLOUR GLOWING TIARAS,4,0.85,United Kingdom,5
21187,WHITE BELL HONEYCOMB PAPER GARLAND ,2,1.65,United Kingdom,5
21696,SMALL SILVER TRELLIS CANDLEPOT,6,2.95,United Kingdom,1
22034,ROBIN CHRISTMAS CARD,3,0.42,United Kingdom,4
20980,36 PENCILS TUBE POSY,1,1.25,United Kingdom,5
35958,FOLKART ZINC STAR CHRISTMAS DEC,4,0.85,United Kingdom,5
75013B,"STRING OF 8 BUTTERFLIES,PINK",4,1.65,United Kingdom,4
22830,UTILTY CABINET WITH HOOKS,1,26.95,United Kingdom,5
22684,FRENCH BLUE METAL DOOR SIGN 9,1,1.25,United Kingdom,4
82011B,BATHROOM SCALES RUBBER DUCKS,1,3.75,United Kingdom,5
21630,FLOOR CUSHION ELEPHANT CARNIVAL,1,8.95,United Kingdom,0
21580,RABBIT  DESIGN  COTTON TOTE BAG,6,2.25,United Kingdom,5
22231,JIGSAW TREE WITH BIRDHOUSE,1,1.45,United Kingdom,1
22859,EASTER TIN BUNNY BOUQUET,2,1.65,United Kingdom,2
22860,EASTER TIN CHICKS PINK DAISY,2,1.65,United Kingdom,5
22093,MOTORING TISSUE BOX,1,1.25,United Kingdom,4
20748,KENSINGTON COFFEE SET,1,12.75,United Kingdom,5
85208,SET/12 FUNKY FELT FLOWER PEG IN BAG,1,2.1,United Kingdom,2
22129,PARTY CONES CANDY TREE DECORATION,6,0.85,United Kingdom,2
22808,SET OF 6 T-LIGHTS EASTER CHICKS,1,2.95,United Kingdom,4
20702,PINK PADDED MOBILE,1,4.25,United Kingdom,4
85187,S/12 MINI RABBIT EASTER,1,1.65,United Kingdom,5
21683,MEDIUM MEDINA STAMPED METAL BOWL ,1,2.95,United Kingdom,2
22770,MIRROR CORNICE,1,14.95,United Kingdom,4
84563B,BLUE & WHITE BREAKFAST TRAY,1,5.95,United Kingdom,5
79190A,RETRO PLASTIC 70'S TRAY,1,0.42,United Kingdom,1
15034,PAPER POCKET TRAVELING FAN ,1,0.14,United Kingdom,5
85129B,BEADED CRYSTAL HEART GREEN SMALL,2,1.25,United Kingdom,2
35924,HANGING FAIRY CAKE DECORATION,2,2.1,United Kingdom,3
20671,BLUE TEATIME PRINT BOWL ,2,1.25,United Kingdom,4
21904,HOUSE WRECKING METAL SIGN ,1,2.1,United Kingdom,5
22843,BISCUIT TIN VINTAGE GREEN,2,6.75,Germany,1
22199,FRYING PAN RED RETROSPOT,4,4.25,Germany,1
84968A,SET OF 16 VINTAGE ROSE CUTLERY,1,12.75,Germany,4
37509,NEW ENGLAND MUG W GIFT BOX,1,2.55,United Kingdom,4
47369A,PINK GREEN EMBROIDERY COSMETIC BAG,1,2.95,United Kingdom,4
47369B,BLUE GREEN EMBROIDERY COSMETIC BAG,1,2.95,United Kingdom,4
47367B,PAIR PADDED HANGERS PINK CHECK,2,3.75,United Kingdom,5
21695,SMALL SILVER FLOWER CANDLE POT,6,2.95,United Kingdom,2
84773,RED ROSE AND LACE C/COVER,3,2.95,United Kingdom,4
21424,WOODLAND STORAGE BOX LARGE ,-1,2.95,United Kingdom,4
21819,GLITTER CHRISTMAS STAR ,6,0.85,United Kingdom,5
22817,CARD SUKI BIRTHDAY,12,0.42,United Kingdom,0
16161U,WRAP SUKI AND FRIENDS,25,0.42,United Kingdom,2
22252,BIRDCAGE DECORATION TEALIGHT HOLDER,12,1.25,United Kingdom,1
21401,BLUE PUDDING SPOON,1,0.42,United Kingdom,5
84597C,RETRO PINK BALL ASHTRAY ,1,1.25,United Kingdom,4
51020A,SUMMER FUN DESIGN SHOWER CAP,1,1.25,United Kingdom,4
51020B,STRIPY DESIGN SHOWER CAP,2,1.25,United Kingdom,4
21306,SET/4 DAISY MIRROR MAGNETS,1,2.1,United Kingdom,4
21311,SET/4 BIRD MIRROR MAGNETS ,1,2.1,United Kingdom,5
21307,SET/4 BUTTERFLY MIRROR MAGNETS,1,2.1,United Kingdom,5
21277,FRENCH STYLE EMBOSSED HEART CABINET,1,21.95,United Kingdom,5
22475,SKULL DESIGN TV DINNER TRAY,2,4.95,United Kingdom,3
90200E,GREEN SWEETHEART BRACELET,2,4.25,United Kingdom,1
90062,CARNIVAL BRACELET,1,12.75,United Kingdom,0
21616,4 PEAR BOTANICAL DINNER CANDLES,4,3.75,United Kingdom,2
37461,FUNKY MONKEY MUG,1,1.25,United Kingdom,5
20659,ECONOMY LUGGAGE TAG,1,1.25,United Kingdom,2
20985,HEART CALCULATOR,1,1.25,United Kingdom,4
84596L,BISCUITS SMALL BOWL LIGHT BLUE,1,1.25,United Kingdom,0
84596F,SMALL MARSHMALLOWS PINK BOWL,1,1.25,United Kingdom,2
22346,PARTY PIZZA DISH GREEN POLKADOT,12,0.85,Germany,2
22344,PARTY PIZZA DISH PINK POLKADOT,12,0.85,Germany,3
85215,ASSORTED CHEESE FRIDGE MAGNETS,1,0.65,United Kingdom,1
85062,PEARL CRYSTAL PUMPKIN T-LIGHT HLDR,24,1.65,United Kingdom,2
22849,"BREAD BIN, DINER STYLE, MINT",4,14.95,United Kingdom,1
22847,"BREAD BIN, DINER STYLE, IVORY",4,14.95,United Kingdom,1
22984,CARD GINGHAM ROSE ,12,0.42,Japan,5
85036C,ROSE 1 WICK MORRIS BOXED CANDLE,1,4.25,United Kingdom,1
21202,DOLLY HONEYCOMB GARLAND,1,1.65,United Kingdom,2
84531A,PINK KNITTED EGG COSY,1,1.95,United Kingdom,5
84531B,BLUE KNITTED EGG COSY,1,1.95,United Kingdom,4
21910,WAY OUT METAL SIGN ,1,1.65,United Kingdom,4
22461,SAVOY ART DECO CLOCK,2,12.75,United Kingdom,2
22833,HALL CABINET WITH 3 DRAWERS,1,49.95,United Kingdom,3
22690,DOORMAT HOME SWEET HOME BLUE ,1,7.95,United Kingdom,5
84881,BLUE WIRE SPIRAL CANDLE HOLDER,2,6.35,United Kingdom,1
21613,S/12 VANILLA  BOTANICAL T-LIGHTS,4,2.95,United Kingdom,5
21693,SMALL HAMMERED SILVER CANDLEPOT ,6,2.95,United Kingdom,2
84809A,WHITE CHRYSANTHEMUMS ART FLOWER,6,2.1,United Kingdom,5
79190D,RETRO PLASTIC DAISY TRAY,1,0.42,United Kingdom,1
22157,ANGEL DECORATION WITH LACE PADDED,24,0.85,United Kingdom,4
84795B,SUNSET CHECK HAMMOCK,4,7.95,United Kingdom,0
20771,CHRYSANTHEMUM  JOURNAL,2,2.55,United Kingdom,1
37327,ASSTD MULTICOLOUR CIRCLES MUG,6,1.69,United Kingdom,4
85027L,FRENCH CHATEAU LARGE PLATTER ,1,7.95,United Kingdom,5
85017C,ENVELOPE 50 CURIOUS IMAGES,5,0.85,United Kingdom,2
16010,FOLDING CAMPING SCISSOR W/KNIF & S,12,0.12,United Kingdom,2
35001W,HAND OPEN SHAPE DECO.WHITE,1,3.49,United Kingdom,4
84707B,PINK JEWELLED MIRROR TRINKET TRAY,1,9.95,United Kingdom,1
21167,WHITE SAGE INCENSE,50,0.21,United Kingdom,4
51008,AFGHAN SLIPPER SOCK PAIR,10,3.45,United Kingdom,4
21713,CITRONELLA CANDLE FLOWERPOT,8,2.1,United Kingdom,4
20802,SMALL GLASS SUNDAE DISH CLEAR,6,1.65,United Kingdom,5
22052,VINTAGE CARAVAN GIFT WRAP,25,0.42,United Kingdom,5
20781,GOLD EAR MUFF HEADPHONES,2,5.49,United Kingdom,3
22389,PAPERWEIGHT SAVE THE PLANET,6,2.55,United Kingdom,0
84840,SWEETHEART CARRY-ALL BASKET,-2,8.5,Italy,1
22073,RED RETROSPOT STORAGE JAR,16,3.39,United Kingdom,4
20716,PARTY FOOD SHOPPER BAG,1,2.51,United Kingdom,5
20782,CAMOUFLAGE EAR MUFF HEADPHONES,4,11.02,United Kingdom,4
20847,ZINC HEART LATTICE CHARGER LARGE,1,7.62,United Kingdom,4
21291,SMALL POLKADOT CHOCOLATE GIFT BAG ,2,1.66,United Kingdom,4
21319,GLASS CHALICE GREEN  SMALL ,2,3.36,United Kingdom,4
21359,RELAX LARGE WOOD LETTERS,1,34.0,United Kingdom,1
21397,BLUE POLKADOT EGG CUP ,1,3.36,United Kingdom,2
21627,ELEPHANT CARNIVAL POUFFE,1,29.79,United Kingdom,2
21632,VINTAGE PINK DECORATIVE PARASOL,1,25.49,United Kingdom,3
22106,MIRROR MOSAIC HURRICANE LAMP ,1,5.06,United Kingdom,3
22108,PING! MICROWAVE PLATE,1,3.36,United Kingdom,0
22221,CAKE STAND LOVEBIRD 2 TIER PINK,1,20.38,United Kingdom,0
22223,CAKE PLATE LOVEBIRD PINK,1,10.17,United Kingdom,4
22282,12 EGG HOUSE PAINTED WOOD,2,25.49,United Kingdom,2
22329,ROUND CONTAINER SET OF 5 RETROSPOT,2,3.36,United Kingdom,2
22416,SET OF 36 DOILIES SPACEBOY DESIGN ,1,2.98,United Kingdom,2
22613,PACK OF 20 SPACEBOY NAPKINS,1,1.66,United Kingdom,2
35648,VINTAGE BEAD PINK PURSE ,1,5.91,United Kingdom,3
35651,VINTAGE BEAD PINK SCARF ,1,16.13,United Kingdom,1
37447,CERAMIC CAKE DESIGN SPOTTED PLATE,2,3.36,United Kingdom,4
46118,FUNKY MONKEY CUSHION COVER,1,8.47,United Kingdom,0
46776C,WOVEN FROST CUSHION COVER,1,4.21,United Kingdom,4
46776E,WOVEN CANDY CUSHION COVER ,1,4.21,United Kingdom,5
62094B,TURQ ICE CREAM BUM BAG ,1,5.06,United Kingdom,5
84078A,SET/4 WHITE RETRO STORAGE CUBES ,1,76.55,United Kingdom,4
84228,HEN HOUSE W CHICK STANDING,1,0.84,United Kingdom,5
84568,GIRLS ALPHABET IRON ON PATCHES ,37,0.43,United Kingdom,1
84789,ENCHANTED BIRD PLANT CAGE,1,7.62,United Kingdom,0
84813,SET OF 4 DIAMOND NAPKIN RINGS,1,25.49,United Kingdom,4
85093,CANDY SPOT EGG WARMER HARE,1,2.51,United Kingdom,0
85096,HILDA CANDY SPOT RABBIT,1,7.62,United Kingdom,2
85202,HANGING WOOD AND FELT HEART,1,0.84,United Kingdom,2
85204,HANGING WOOD AND FELT FLOWER,1,0.84,United Kingdom,2
90001D,ANTIQUE OLIVE GREEN FLOWER EARRINGS,1,4.24,United Kingdom,4
90013C,GREEN VINTAGE EARRINGS ,1,4.24,United Kingdom,4
90014B,GOLD M PEARL  ORBIT NECKLACE,1,10.62,United Kingdom,0
90085,CRYSTAL STILETTO PHONE CHARM,1,1.66,United Kingdom,3
90132,LIGHT TOPAZ TEAL/AQUA COL NECKLACE,1,5.09,United Kingdom,0
90140,PINK SWEETIE NECKLACE,1,7.64,United Kingdom,2
90141B,IVORY PENDANT TRIPLE SHELL NECKLACE,1,5.09,United Kingdom,5
90158,ST TROPEZ NECKLACE,1,5.09,United Kingdom,4
90183A,AMBER DROP EARRINGS W LONG BEADS,1,2.96,United Kingdom,1
90183B,AMETHYST DROP EARRINGS W LONG BEADS,1,2.96,United Kingdom,1
90201B,BLACK ENAMEL FLOWER RING,1,2.96,United Kingdom,4
90212B,JET BLACK LAS VEGAS BRACELET ROUND,1,3.81,United Kingdom,0
84712B,PINK JEWELLED PHOTO FRAME,3,7.95,United Kingdom,5
22279,POCKET BAG BLUE PAISLEY RED SPOT,3,1.25,United Kingdom,5
22280,POCKET BAG PINK PAISELY BROWN SPOT,3,1.25,United Kingdom,2
22377,BOTTLE BAG RETROSPOT ,1,4.21,United Kingdom,2
22495,SET OF 2 ROUND TINS CAMEMBERT ,1,5.91,United Kingdom,3
22521,CHILDS GARDEN TROWEL PINK,1,1.66,United Kingdom,2
22523,CHILDS GARDEN FORK PINK,1,1.66,United Kingdom,5
22677,FRENCH BLUE METAL DOOR SIGN 2,1,2.51,United Kingdom,4
22682,FRENCH BLUE METAL DOOR SIGN 7,1,2.51,United Kingdom,4
22715,CARD WEDDING DAY,1,0.85,United Kingdom,2
21253,SET OF PICTURE FRAME  STICKERS,1,5.91,United Kingdom,5
21265,PINK GOOSE FEATHER TREE 60CM,1,5.91,United Kingdom,0
21389,IVORY HANGING DECORATION  BIRD,1,1.66,United Kingdom,5
21391,FRENCH LAVENDER SCENT HEART,1,4.21,United Kingdom,5
21403,BLUE EGG  SPOON,2,0.85,United Kingdom,5
21534,DAIRY MAID LARGE MILK JUG,1,10.17,United Kingdom,4
21618,4 WILDFLOWER BOTANICAL CANDLES,1,7.62,United Kingdom,4
21812,GARLAND WITH HEARTS AND BELLS,1,10.17,United Kingdom,4
21847,GREEN  DIAMANTE PEN IN GIFT BOX,1,4.21,United Kingdom,2
21943,CAKES AND RABBITS DESIGN FLANNEL ,1,1.66,United Kingdom,5
22104,MIRROR MOSAIC CANDLE PLATE,1,1.66,United Kingdom,4
22322,BIRD DECORATION GREEN POLKADOT,1,1.66,United Kingdom,1
22340,NOEL GARLAND PAINTED ZINC ,1,3.36,United Kingdom,5
35833G,4 GOLD FLOCK CHRISTMAS BALLS,2,3.36,United Kingdom,5
35916A,YELLOW FELT HANGING HEART W FLOWER,5,1.66,United Kingdom,2
46776A,WOVEN BUBBLE GUM CUSHION COVER,2,4.21,United Kingdom,1
72351B,SET/6 PINK  BUTTERFLY T-LIGHTS,1,4.21,United Kingdom,5
84459A,PINK METAL CHICKEN HEART ,1,3.36,United Kingdom,4
84637,KITCHEN FLOWER POTS WALL PLAQUE,1,12.72,United Kingdom,5
85039B,S/4 IVORY MINI ROSE CANDLE IN BOWL,1,1.66,United Kingdom,1
85039C,S/4 BLACK MINI ROSE CANDLE IN BOWL,1,1.66,United Kingdom,0
85131C,BEADED CRYSTAL HEART BLUE ON STICK,7,0.85,United Kingdom,5
90010E,AMBER GLASS/SILVER BRACELET,4,9.34,United Kingdom,4
90039C,FIRE POLISHED GLASS BRACELET BLACK,1,3.81,United Kingdom,0
90056,CHUNKY CRACKED GLAZE NECKLACE IVORY,1,11.05,United Kingdom,4
90081C,LILY BROOCH OLIVE COLOUR,1,5.09,United Kingdom,5
90101,WHITE FRANGIPANI NECKLACE,1,2.54,United Kingdom,3
90130B,TURQ STONE/CRYSTAL EARRINGS,1,2.96,United Kingdom,0
90130C,GREEN STONE/CRYSTAL EARRINGS,1,2.96,United Kingdom,2
15044C,PURPLE PAPER PARASOL,2,5.91,United Kingdom,4
20762,GREEN FERN SKETCHBOOK ,1,7.62,United Kingdom,4
20803,SMALL PINK GLASS SUNDAE DISH,4,3.36,United Kingdom,5
18007,ESSENTIAL BALM 3.5g TIN IN ENVELOPE,24,0.18,United Kingdom,1
21720,CAKE SHOP  STICKER SHEET,12,0.85,United Kingdom,4
22952,72 CAKE CASES VINTAGE CHRISTMAS,24,0.55,United Kingdom,1
84968F,SET OF 16 VINTAGE SKY BLUE CUTLERY,1,12.75,United Kingdom,1
21289,LARGE STRIPES CHOCOLATE GIFT BAG,16,1.25,United Kingdom,5
22606,WOODEN SKITTLES GARDEN SET,1,15.95,United Kingdom,5
37479B,CUBIC MUG FLOCK BLUE ON BROWN,1,2.55,United Kingdom,4
37482P,CUBIC MUG PINK POLKADOT,1,2.55,United Kingdom,4
20903,VINTAGE KEEPSAKE BOX TRAVELOGUE,2,6.35,United Kingdom,4
20897,VINTAGE NOTEBOOK PARIS DAYS,6,2.95,United Kingdom,5
71403,"PINK/WHITE ""KEEP CLEAN"" BULLET BIN",1,2.95,United Kingdom,2
22683,FRENCH BLUE METAL DOOR SIGN 8,2,1.25,United Kingdom,1
22685,FRENCH BLUE METAL DOOR SIGN 0,2,1.25,United Kingdom,4
21973,SET OF 36 MUSHROOM PAPER DOILIES,6,1.45,United Kingdom,5
22691,DOORMAT WELCOME SUNRISE,1,7.95,United Kingdom,4
21162,TOXIC AREA  DOOR HANGER ,1,1.45,United Kingdom,4
84926D,LA PALMIERA TILE COASTER,1,1.25,United Kingdom,4
22233,JIGSAW RABBIT AND BIRDHOUSE,2,1.65,United Kingdom,4
35400,WOODEN BOX ADVENT CALENDAR ,-1,8.95,United Kingdom,0
22486,PLASMATRONIC LAMP,2,12.75,United Kingdom,5
72801G,4 BURGUNDY WINE DINNER CANDLES,2,1.25,United Kingdom,2
84711A,SILVER OVAL SHAPE TRINKET BOX,2,9.95,United Kingdom,3
16169N,WRAP BLUE RUSSIAN FOLKART,25,0.42,United Kingdom,2
20769,DAISY JOURNAL ,3,2.55,United Kingdom,4
35597A,DUSTY PINK CHRISTMAS TREE 30CM,1,1.25,United Kingdom,4
47480,HANGING PHOTO CLIP ROPE LADDER,1,1.65,United Kingdom,1
84522,PINK PARTY SUNGLASSES,1,1.95,United Kingdom,0
20731,POSY CANDY BAG,1,1.25,United Kingdom,4
35597B,BLACKCHRISTMAS TREE 30CM,1,1.25,United Kingdom,3
84596B,SMALL DOLLY MIX DESIGN ORANGE BOWL,1,1.25,United Kingdom,0
21226,POCKET MIRROR WOODLAND,1,1.25,United Kingdom,5
79160,HEART SHAPE WIRELESS DOORBELL,1,2.1,United Kingdom,4
21089,SET/6 GREEN SPRING PAPER CUPS,2,0.65,United Kingdom,4
21647,ASSORTED TUTTI FRUTTI LARGE PURSE,1,2.1,United Kingdom,5
72122,COFFEE SCENT PILLAR CANDLE,1,0.95,United Kingdom,1
84912A,PINK ROSE WASHBAG,1,3.75,United Kingdom,4
85036A,GARDENIA 1 WICK MORRIS BOXED CANDLE,1,4.25,United Kingdom,4
21692,SILVER LATTICE VANILLA CANDLE POT,1,3.75,United Kingdom,0
84569A,PACK 3 IRON ON DOG PATCHES,12,1.25,United Kingdom,4
20775,DAISY NOTEBOOK ,1,1.65,United Kingdom,2
90179C,BLACK FINE BEAD NECKLACE W TASSEL,1,5.95,United Kingdom,4
90060D,FIRE POLISHED GLASS NECKL BRONZE,1,5.95,United Kingdom,4
85020,ROUND PINK HEART MIRROR,8,2.1,United Kingdom,2
20861,GOLD COSMETIC BAG PINK STAR,1,2.1,United Kingdom,5
21827,EIGHT PIECE CREEPY CRAWLIE SET,1,1.25,United Kingdom,2
79051A,SMOKEY GREY COLOUR D.O.F. GLASS,4,0.65,United Kingdom,5
17007B,S/3 POT POURI CUSHIONS BLUE COLOURS,12,2.1,United Kingdom,4
22700,BLACK AND WHITE DOG BOWL,6,2.95,United Kingdom,1
10124A,SPOTS ON RED BOOKCOVER TAPE,4,0.42,United Kingdom,0
21644,ASSORTED TUTTI FRUTTI HEART BOX,2,1.25,United Kingdom,4
46000P,POLYESTER FILLER PAD 65CMx65CM,2,4.25,United Kingdom,2
22681,FRENCH BLUE METAL DOOR SIGN 6,1,1.25,United Kingdom,1
21746,SMALL RED RETROSPOT WINDMILL,1,1.25,United Kingdom,2
84916,HAND TOWEL PALE BLUE W FLOWERS,1,5.95,United Kingdom,4
40005B,BLUE ORGANDY ROUND LAMPSHADE W BEA,1,0.85,United Kingdom,5
18094C,WHITE AND BLUE CERAMIC OIL BURNER,1,1.25,United Kingdom,5
22085,PAPER CHAIN KIT SKULLS ,1,2.95,United Kingdom,5
47586A,PINK FAIRY CAKE CUSHION COVER,2,2.55,United Kingdom,3
46115B,GREEN POP ART MAO CUSHION COVER ,6,0.19,United Kingdom,5
84975,HEART SHAPED MIRROR,3,1.69,United Kingdom,2
21336,GOLD WASHBAG,1,2.95,United Kingdom,4
22050,PINK PAISLEY ROSE GIFT WRAP,25,0.42,United Kingdom,5
21680,WOODLAND  STICKERS,6,0.85,United Kingdom,4
20819,SILVER TEDDY BEAR,1,3.75,United Kingdom,0
84925F,PSYCHEDELIC WALL THERMOMETER,1,2.55,United Kingdom,4
22535,MAGIC DRAWING SLATE BUNNIES ,2,0.42,United Kingdom,4
84968F,check,-20,0.0,United Kingdom,1
16169K,WRAP FOLK ART,25,0.42,United Kingdom,2
35833G,damages,-43,0.0,United Kingdom,3
21001,ROSE DU SUD WASHBAG ,3,4.21,United Kingdom,4
21028,NINJA RABBIT BLACK,1,2.51,United Kingdom,5
21171,BATHROOM METAL SIGN ,1,3.36,United Kingdom,2
21204,DAISIES  HONEYCOMB GARLAND ,1,3.36,United Kingdom,1
21222,SET/4 BADGES BEETLES,1,2.51,United Kingdom,4
21251,DINOSAUR HEIGHT CHART STICKER SET,1,5.91,United Kingdom,5
21375,LARGE CAMPHOR WOOD FIELD MUSHROOM ,2,11.02,United Kingdom,2
21595,Dad's Cab Electronic Meter,1,8.47,United Kingdom,1
22101,MIRROR MOSAIC VOTIVE HOLDER,10,2.51,United Kingdom,5
35914,PINK CHICK EGG WARMER + EGG CUP,2,4.21,United Kingdom,4
37462E,"PET MUG, GOLDFISH",2,0.84,United Kingdom,0
37474,SET/4 2 TONE EGG SHAPE MIXING BOWLS,1,9.95,United Kingdom,2
47481,50CM METAL STRING WITH  7 CLIPS,1,2.13,United Kingdom,1
84313B,BLUE TV TRAY TABLE ,1,16.98,United Kingdom,4
84422,PINK/BLUE DISC/MIRROR STRING,1,1.66,United Kingdom,2
84429A,MEDIUM PINK BUDDHA HEAD ,2,5.91,United Kingdom,3
84510C,SET OF 4 POLKADOT COASTERS,1,2.51,United Kingdom,2
84917,WHITE HAND TOWEL WITH BUTTERFLY,1,4.21,United Kingdom,4
85087,CANDY SPOT CUSHION COVER,1,8.47,United Kingdom,0
85094,CANDY SPOT EGG WARMER RABBIT,1,2.51,United Kingdom,4
85125,SMALL ROUND CUT GLASS CANDLESTICK,2,10.17,United Kingdom,5
90013A,MIDNIGHT BLUE VINTAGE EARRINGS,1,3.81,United Kingdom,5
90059A,DIAMANTE HAIR GRIP PACK/2 CRYSTAL,1,1.69,United Kingdom,2
90073,VINTAGE ENAMEL & CRYSTAL EARRINGS,1,5.09,United Kingdom,0
90074,BLACK DIAMOND CLUSTER NECKLACE,1,9.77,United Kingdom,2
90104,PURPLE FRANGIPANI HAIRCLIP,2,0.83,United Kingdom,5
90129C,GREEN GLASS TASSLE BAG CHARM,3,1.66,United Kingdom,1
90129D,AMBER GLASS TASSLE BAG CHARM,1,1.66,United Kingdom,4
90129E,PURPLE GLASS TASSLE BAG CHARM,4,1.66,United Kingdom,4
90160C,TURQ+RED BOUDICCA LARGE BRACELET,1,7.22,United Kingdom,0
90161D,ANT COPPER PINK BOUDICCA BRACELET,2,5.09,United Kingdom,5
90175B,PINK GLASS CHUNKY CHARM BRACELET,1,9.34,United Kingdom,5
90177D,DROP DIAMANTE EARRINGS PURPLE,1,2.96,United Kingdom,2
90184C,BLACK CHUNKY BEAD BRACELET W STRAP,1,9.34,United Kingdom,1
90185A,AMBER DIAMANTE EXPANDABLE RING,1,4.24,United Kingdom,0
90208,PAIR OF PINK FLOWER CLUSTER SLIDE,1,2.54,United Kingdom,1
15044D,RED PAPER PARASOL,1,5.91,United Kingdom,5
84707A,SILVER JEWELLED MIRROR TRINKET TRAY,4,9.95,United Kingdom,4
21617,4 LILY  BOTANICAL DINNER CANDLES,12,3.75,United Kingdom,4
